{
  "schemaVersion": 1,
  "protocolVersion": 1,
  "taskId": "pre-question-autonomy-hardening-fifth-blind-test-2026-08-13",
  "contractFingerprint": "24c485842d0915b22906b64b9c6c9e5ad444b5882a52ff1f9b92c5b49390ffe5",
  "routeFingerprint": "78fa64036de7624e4c0940de4f0ed2652348f901eafbb6aad948daa6e827f397",
  "stateFingerprint": "e971e34ee9d8dea04b00091373801ba345bf347d7d02ac3d1c1ae61382f754e1",
  "status": "in-progress",
  "taskStatus": "in-progress",
  "verificationStatus": "not-verified",
  "publicationStatus": "local-only",
  "productionReadiness": "not-verified",
  "selectedGuides": [
    "clean",
    "test",
    "security"
  ],
  "changedPaths": [
    ".cursor/rules/project-loop.mdc",
    ".github/copilot-instructions.md",
    "AGENTS.md",
    "CLAUDE.md",
    "LOOP_ENGINEERING.md",
    "QUALITY_SCORECARD.md",
    "conformance/runs/2026-08-13-codex-fourth-live.md",
    "src/core/decision-classification.js",
    "tests/autonomy-policy.test.js",
    "tests/conformance-scenarios.test.js",
    "tests/decision-classification.test.js"
  ],
  "checks": [
    {
      "schemaVersion": 1,
      "protocolVersion": 1,
      "id": "tests",
      "kind": "command",
      "requirement": "tests",
      "status": "passed",
      "evidenceKind": "OBSERVED",
      "source": "npm test",
      "exitCode": 0,
      "details": {
        "command": "npm test",
        "result": "369 passed, 0 failed"
      }
    },
    {
      "schemaVersion": 1,
      "protocolVersion": 1,
      "id": "documentation",
      "kind": "command",
      "requirement": "documentation",
      "status": "passed",
      "evidenceKind": "OBSERVED",
      "source": "python3 scripts/validate_loop_system.py && python3 scripts/validate_markdown.py",
      "exitCode": 0,
      "details": {
        "command": "python3 scripts/validate_loop_system.py && python3 scripts/validate_markdown.py",
        "result": "loop system and Markdown validators passed"
      }
    },
    {
      "schemaVersion": 1,
      "protocolVersion": 1,
      "id": "package",
      "kind": "command",
      "requirement": "package",
      "status": "passed",
      "evidenceKind": "OBSERVED",
      "source": "npm run pack:check",
      "exitCode": 0,
      "details": {
        "command": "npm run pack:check",
        "result": "4 passed, 0 failed"
      }
    },
    {
      "schemaVersion": 1,
      "protocolVersion": 1,
      "id": "security-validation",
      "kind": "command",
      "requirement": "security-validation",
      "status": "passed",
      "evidenceKind": "OBSERVED",
      "source": "python3 scripts/scan_secrets.py",
      "exitCode": 0,
      "details": {
        "command": "python3 scripts/scan_secrets.py",
        "result": "256 text files scanned; no secret findings"
      }
    }
  ],
  "evidence": [
    {
      "kind": "OBSERVED",
      "source": "npm test",
      "result": "369 passed, 0 failed"
    },
    {
      "kind": "OBSERVED",
      "source": "python3 scripts/validate_loop_system.py && python3 scripts/validate_markdown.py",
      "result": "loop system and Markdown validators passed"
    },
    {
      "kind": "OBSERVED",
      "source": "npm run pack:check",
      "result": "4 passed, 0 failed"
    },
    {
      "kind": "OBSERVED",
      "source": "python3 scripts/scan_secrets.py",
      "result": "256 text files scanned; no secret findings"
    }
  ],
  "evidenceCoverage": [
    {
      "schemaVersion": 1,
      "protocolVersion": 1,
      "requirement": "documentation",
      "requiredEvidence": [
        "documentation"
      ],
      "observedEvidence": [
        "documentation"
      ],
      "status": "COVERED"
    },
    {
      "schemaVersion": 1,
      "protocolVersion": 1,
      "requirement": "package",
      "requiredEvidence": [
        "package"
      ],
      "observedEvidence": [
        "package"
      ],
      "status": "COVERED"
    },
    {
      "schemaVersion": 1,
      "protocolVersion": 1,
      "requirement": "security-validation",
      "requiredEvidence": [
        "security-validation"
      ],
      "observedEvidence": [
        "security-validation"
      ],
      "status": "COVERED"
    },
    {
      "schemaVersion": 1,
      "protocolVersion": 1,
      "requirement": "tests",
      "requiredEvidence": [
        "tests"
      ],
      "observedEvidence": [
        "tests"
      ],
      "status": "COVERED"
    }
  ],
  "review": {
    "status": "not-run",
    "independent": false
  },
  "limitations": [],
  "publication": {
    "committed": false,
    "pushed": false,
    "pullRequest": null,
    "deployed": false
  }
}
